{
  "country_iso": "GB",
  "cutoff_utc": "2026-10-29T23:59:59Z",
  "evidence": [
    {
      "definition": "Revenue funding allocated per pupil, cash terms; estimates and no capital",
      "geographic_scope": "England state-funded school revenue allocations for pupils aged 5-16",
      "licence_or_terms": "UK Open Government Licence v3.0, except excluded rights; https://www.nationalarchives.gov.uk/doc/open-government-licence/version/3/",
      "missing_reason": null,
      "normalized_unit": "GBP per pupil",
      "publisher": "Department for Education",
      "raw_unit": "GBP per pupil",
      "reference_period": "2026-27 financial-year allocations",
      "release_date": "2026-01-29",
      "retrieval_date": "2026-10-30",
      "sha256_hex": "929737d33daf7412e1101ca68bda99f9798d7c30cb1a033bf5ccbb3771e9dc12",
      "source_url": "https://explore-education-statistics.service.gov.uk/find-statistics/school-funding-statistics/2025-26",
      "stable_variable_id": "allocated_funding_per_pupil_2026_27",
      "transformation": "identity"
    },
    {
      "definition": "Total revenue funding allocated, cash terms; estimates and no capital",
      "geographic_scope": "England state-funded school revenue allocations for pupils aged 5-16",
      "licence_or_terms": "UK Open Government Licence v3.0, except excluded rights; https://www.nationalarchives.gov.uk/doc/open-government-licence/version/3/",
      "missing_reason": null,
      "normalized_unit": "GBP",
      "publisher": "Department for Education",
      "raw_unit": "GBP billion",
      "reference_period": "2026-27 financial-year allocations",
      "release_date": "2026-01-29",
      "retrieval_date": "2026-10-30",
      "sha256_hex": "929737d33daf7412e1101ca68bda99f9798d7c30cb1a033bf5ccbb3771e9dc12",
      "source_url": "https://explore-education-statistics.service.gov.uk/find-statistics/school-funding-statistics/2025-26",
      "stable_variable_id": "allocated_funding_total_2026_27",
      "transformation": "GBP billions * 1000000000"
    },
    {
      "definition": "Share of eligible pupils for FSM; NOT an income-band measure",
      "geographic_scope": "England school census (state-funded and independent scope varies)",
      "licence_or_terms": "UK Open Government Licence v3.0, except excluded rights; https://www.nationalarchives.gov.uk/doc/open-government-licence/version/3/",
      "missing_reason": null,
      "normalized_unit": "ppm",
      "publisher": "Department for Education",
      "raw_unit": "percent",
      "reference_period": "January 2026 census / academic year 2025/26",
      "release_date": "2026-06-04",
      "retrieval_date": "2026-10-30",
      "sha256_hex": "22260725e61d269d031e97381216582033477bc17ab507e6678781ec08618ea3",
      "source_url": "https://explore-education-statistics.service.gov.uk/find-statistics/school-pupils-and-their-characteristics/2025-26",
      "stable_variable_id": "fsm_eligibility_rate",
      "transformation": "percent * 10000"
    },
    {
      "definition": "FTE pupils divided by FTE teachers, cross-census PTR",
      "geographic_scope": "England state-funded schools",
      "licence_or_terms": "UK Open Government Licence v3.0, except excluded rights; https://www.nationalarchives.gov.uk/doc/open-government-licence/version/3/",
      "missing_reason": null,
      "normalized_unit": "pupils per teacher",
      "publisher": "Department for Education",
      "raw_unit": "pupils per teacher",
      "reference_period": "November 2025",
      "release_date": "2026-06-04",
      "retrieval_date": "2026-10-30",
      "sha256_hex": "8e76af6a222fa85be148a23b1a88e275bfa0cfc9495b7014fc2f5f1dc8418f6b",
      "source_url": "https://explore-education-statistics.service.gov.uk/find-statistics/school-workforce-in-england/2025",
      "stable_variable_id": "pupil_teacher_ratio",
      "transformation": "identity"
    },
    {
      "definition": "Number of all schools (state-funded and independent included)",
      "geographic_scope": "England school census (state-funded and independent scope varies)",
      "licence_or_terms": "UK Open Government Licence v3.0, except excluded rights; https://www.nationalarchives.gov.uk/doc/open-government-licence/version/3/",
      "missing_reason": null,
      "normalized_unit": "schools",
      "publisher": "Department for Education",
      "raw_unit": "schools",
      "reference_period": "January 2026 census / academic year 2025/26",
      "release_date": "2026-06-04",
      "retrieval_date": "2026-10-30",
      "sha256_hex": "22260725e61d269d031e97381216582033477bc17ab507e6678781ec08618ea3",
      "source_url": "https://explore-education-statistics.service.gov.uk/find-statistics/school-pupils-and-their-characteristics/2025-26",
      "stable_variable_id": "school_count",
      "transformation": "identity"
    },
    {
      "definition": "FTE of all teachers in state-funded schools, qualified and unqualified",
      "geographic_scope": "England state-funded schools",
      "licence_or_terms": "UK Open Government Licence v3.0, except excluded rights; https://www.nationalarchives.gov.uk/doc/open-government-licence/version/3/",
      "missing_reason": null,
      "normalized_unit": "FTE",
      "publisher": "Department for Education",
      "raw_unit": "FTE",
      "reference_period": "November 2025",
      "release_date": "2026-06-04",
      "retrieval_date": "2026-10-30",
      "sha256_hex": "8e76af6a222fa85be148a23b1a88e275bfa0cfc9495b7014fc2f5f1dc8418f6b",
      "source_url": "https://explore-education-statistics.service.gov.uk/find-statistics/school-workforce-in-england/2025",
      "stable_variable_id": "teacher_fte",
      "transformation": "identity"
    },
    {
      "definition": "Full and part-time teacher vacancies as proportion of teachers in service",
      "geographic_scope": "England state-funded schools",
      "licence_or_terms": "UK Open Government Licence v3.0, except excluded rights; https://www.nationalarchives.gov.uk/doc/open-government-licence/version/3/",
      "missing_reason": null,
      "normalized_unit": "ppm",
      "publisher": "Department for Education",
      "raw_unit": "percent",
      "reference_period": "November 2025",
      "release_date": "2026-06-04",
      "retrieval_date": "2026-10-30",
      "sha256_hex": "8e76af6a222fa85be148a23b1a88e275bfa0cfc9495b7014fc2f5f1dc8418f6b",
      "source_url": "https://explore-education-statistics.service.gov.uk/find-statistics/school-workforce-in-england/2025",
      "stable_variable_id": "teacher_vacancy_rate",
      "transformation": "percent * 10000"
    },
    {
      "definition": "FTE teaching assistants in state-funded schools",
      "geographic_scope": "England state-funded schools",
      "licence_or_terms": "UK Open Government Licence v3.0, except excluded rights; https://www.nationalarchives.gov.uk/doc/open-government-licence/version/3/",
      "missing_reason": null,
      "normalized_unit": "FTE",
      "publisher": "Department for Education",
      "raw_unit": "FTE",
      "reference_period": "November 2025",
      "release_date": "2026-06-04",
      "retrieval_date": "2026-10-30",
      "sha256_hex": "8e76af6a222fa85be148a23b1a88e275bfa0cfc9495b7014fc2f5f1dc8418f6b",
      "source_url": "https://explore-education-statistics.service.gov.uk/find-statistics/school-workforce-in-england/2025",
      "stable_variable_id": "teaching_assistant_fte",
      "transformation": "identity"
    }
  ],
  "locale": "en-GB",
  "schema_version": 1,
  "simulated_jurisdiction": "england"
}
